Id,Name,Shape Library,Page ID,Contained By,Group,Line Source,Line Destination,Source Arrow,Destination Arrow,Status,Text Area 1,Text Area 2
179,Process,Flowchart Shapes,2,16,,,,,,,"What counts as a drug is defined by Massachusetts law. It includes things like cocaine, heroin and pills that aren’t prescribed by a doctor. It also includes marijuana. It does not include alcohol and tobacco.
                                                                                                                                    Is the school accusing the student of having something that fits the legal definition of drug?
                                                                                                                                       See the full law at the below link: https://malegislature.gov/Laws/GeneralLaws/PartI/TitleXV/Chapter94C/Section1",
180,Process,Flowchart Shapes,2,16,,,,,,,"if you aren't sure about the answer to a question, we recommend that you call the EdLaw Project help-line at 617-910-5829 for help.",
181,Process,Flowchart Shapes,2,16,,,,,,,"Okay, we'll move on to the next section.  ",
182,Process,Flowchart Shapes,2,16,,,,,,,"You said that the school is accusing the student of assaulting school staff.  This means that the discipline is covered by a Massachusetts law called 71 MGL §37H.  You can read the full law at the following link: https://malegislature.gov/laws/generallaws/parti/titlexii/chapter71/section37h  A student can be suspended or expelled for assaulting educational staff. But, the law says that only certain things count as assault'and only certain school staff count as educational staff. Sometimes, schools say that the student assaulted educational staff even when what the student did does not count as assault, or the staff member does not count as educational staff.
                                                                                      To start, we are going to ask some questions about what the school says the student did. This will help us to find out if the school can punish the student for assaulting educational staff. These questions will only be about what the school says happened, later we will have questions about the student’s side of the story.  ",
183,Process,Flowchart Shapes,2,16,,,,,,,"We'll look at what an assault is first, and then we'll look at who is an educational staff.
                                                                               What action counts as an assault is not always clear. But some action definitely count as an assault. For example, kicking, hitting, punching or throwing something at another person and hitting that person definitely are assaults.
                                                                                   Did the school say that the student did something that definitely counts as an assault?",
184,Process,Flowchart Shapes,2,16,,,,,,,It might be helpful to talk to someone about your student’s situation.                                                 									                     We recommend that you call the EdLaw Project help-line at 617-910-5829 for help.,
185,Process,Flowchart Shapes,2,16,,,,,,,"Educational staff are people whose job is to educate students. Some examples are teachers, teacher's aids, principals, and guidance counselors.                                       Is the school saying that the student assaulted someone whose job is to educate students? ",
186,Process,Flowchart Shapes,2,16,,,,,,,"School Police Officers are police who work in a school building. Their job is to keep the school safe, not to educate students. If the school is saying that the student assaulted a school police officer, you can argue that the police officer is not educational staff. Would you like to include that in your complaint?",
187,Process,Flowchart Shapes,2,16,,,,,,,"Okay, we'll move on to the next section.",
188,Process,Flowchart Shapes,2,16,,,,,,,"You said that the school is trying to punish the student for assaulting educational staff. But that the staff member invovled is a police officer.    This legal language will be included in your complaint:""The school is moving to discipline the student for assaulting a member of the school’s educational staff, however the incident involved the student and a police officer, who is not educational staff as defined by MGL c.37H.  Therefore the school is improperly moving to discipline the student under 37H for alleged conduct that doesn’t fall within the offenses in 71 MGL s.37H.""  In the box below, explain what happened.                                        ",
189,Process,Flowchart Shapes,2,16,,,,,,,"Okay, we'll move on to the next section.",
190,Process,Flowchart Shapes,2,17,,,,,,,"Students have certain rights that must be followed before the school can suspend or expel them. The student has a right to a meeting / hearing with the principal. Before the hearing happens, the school must send the student and the family a letter or email telling them about the hearing, including date and time.  This is called 'notice.' The notice must be in writing, it is not enough for the principal to just tell the family about the hearing in person or over the phone.
                                                                   Did the school send a letter or email to the student and family about the meeting?",
191,Process,Flowchart Shapes,2,17,,,,,,,You said that the school did not send the family a letter or email about the hearing before the hearing happened. This is a violation of the student’s rights. Would you like to include that concern in your complaint?,
192,Process,Flowchart Shapes,2,17,,,,,,,"You said that the school did not send the family a letter or email about the hearing. This is a violation of the student’s rights.   This legal language will be included in your complaint:	
""The Principal failed to send notice to the student of a disciplinary hearing when they moved to exclude the student under chapter 37H""   In the box below explain what happened. Include any information you have about how the student found out they were being suspended or expelled. If you or the student's family missed the hearing because you didn't know about it, make sure to include that. ",
193,Process,Flowchart Shapes,2,17,,,,,,,"Next we're going to go through the information that the school has to include in the notice. If you have a copy of the notice, it may be helpful to take it out to reference while you're answering these questions.",
194,Process,Flowchart Shapes,2,17,,,,,,,"The notice has to include information about the student's rights at the hearing, including that they have the right to present evidence and witnesses.    pop up: what does 'present evidence and witnesses' mean? inside the pop up: 'Present evidence' means they can show the principal anything that supports their side of the story.   'Present witnesses' means they can have other people come to the hearing if they can support the student's side of the story.    Did the letter say that the student had the right to present evidence and witnesses at the hearing? ",
195,Process,Flowchart Shapes,2,17,,,,,,,"The notice has to say that the student has the right to bring an attorney at the family's expense.    This means that the school can't prevent an attorney from being at the hearing, if the family has one.  Did the letter say that the student had the right to bring an attorney to the hearing?",
196,Process,Flowchart Shapes,2,17,,,,,,,"You identified that the notice didn't say that the student had the right to present evidence and witnesses at the hearing.  This language will identify that in your complaint: ""The Principal failed to send appropriate notice to the student of a disciplinary hearing when they moved to exclude the student under chapter 37H, because the notice did not include the student's right to present evidence and witnesses at the hearing.""   Provide more details in the box below.",
197,Process,Flowchart Shapes,2,17,,,,,,,"You identified that the notice didn't say that the student had the right to present evidence and witnesses at the hearing.  This language will identify that in your complaint: ""The Principal failed to send appropriate notice to the student of a disciplinary hearing when they moved to exclude the student under chapter 37H, because the notice did not include the student's right to bring an attorney to the hearing.""   Provide more details in the box below.  Include anything that happened because you didn't get that information.  ",
198,Process,Flowchart Shapes,2,18,,,,,,,"Now we're going to go through some questions about the hearing.    Did the principal have the hearing, or a meeting to discuss the potential suspension or expulsion?",
199,Process,Flowchart Shapes,2,18,,,,,,,You identified that the principal didn't have a hearing.  Would you like to include that in your complaint?,
200,Process,Flowchart Shapes,2,18,,,,,,,"You identified that the principal didn't have a hearing.    This language will identify that problem in your complaint: ""The principal excluded the student under 37H without holding a hearing""  In the box below, describe what happened in detail.",
201,Process,Flowchart Shapes,2,18,,,,,,,"Okay, we'll move on to the next section. ",
202,Process,Flowchart Shapes,2,18,,,,,,,"if the family has an advocate or attorney, the student has the right to have that person at the hearing. This means that the school can't prevent an advocate from coming to the meeting if the family brings one. It also means that the school has to be reasonable in scheduling the hearing so the advocate can come.  Did the student try to bring an attorney or other advocate to the hearing?",
203,Process,Flowchart Shapes,2,18,,,,,,,Did the school allow the student's attorney or advocate to come to the hearing?,
204,Process,Flowchart Shapes,2,18,,,,,,,The student has the right to present evidence and witnesses at the hearing.  'Present evidence' means they can show the principal anything that supports their side of the story.    'Present witnesses' means they can have other people come to the hearing if they can support the student's side of the story.    Was the student able to present evidence and witnesses at the hearing?,
205,Process,Flowchart Shapes,2,18,,,,,,,"You identified that the student tried to bring an attorney to the hearing, but the school didn't let them.   This language will identify that in your complaint: ""The student was not afforded the right to representation at a hearing with the principal pursuant to 71 MGL s.37H""  In the box below, describe what happened in detail.  How did the school prevent the attorney from coming to the hearing? ",
206,Process,Flowchart Shapes,2,18,,,,,,,"You identified that the student wasn't able to present evidence and witnesses at the hearing.  This language will identify that in your complaint: ""The student was not afforded the right to present evidence and witnesses at a hearing with the principal pursuant to MGL c.71 s.37H""   In the box below, describe what happened in detail.  How did the principal prevent the student from presenting evidence and witnesses?  Was there specific evidence the student wanted to show the principal? Were there specific witnesses the student wanted to bring to the hearing?",
207,Process,Flowchart Shapes,2,18,,,,,,,"You identified that the student wasn't able to tell their side of the story at the hearing.  This language will identify that in your complaint: ""The principal did not hold an appropriate hearing pursuant to MGL c.71 s.37H.""   In the box below, describe what happened at the hearing in detail.  What prevented the student from telling their side of the story? ",
208,Process,Flowchart Shapes,2,18,,,,,,,"Okay, we'll move on to the next section.",
209,Process,Flowchart Shapes,2,19,,,,,,,"If the school decided to expel the student, the student has the right to appeal their decision to the School District's superintendent.  ",
210,Process,Flowchart Shapes,2,19,,,,,,,"To appeal the principal's decision, the student has 10 days from the date they're expelled to tell the superintendent they want to appeal.  Did the student request an appeal within 10 days?",
211,Process,Flowchart Shapes,2,19,,,,,,,"Once the student requests an appeal, the superintendent has to schedule a hearing on the appeal.  Did the superintendent have the  hearing?",
212,Process,Flowchart Shapes,2,19,,,,,,,The appeal has to actually be with the superintendent.  The superintendent can't send someone else to run the hearing.  Was the hearing with the superintendent?,
213,Process,Flowchart Shapes,2,19,,,,,,,"The student has the right to bring an attorney to the hearing, if their family pays for it.    Did the student hire an attorney to bring to the hearing?",
214,Process,Flowchart Shapes,2,19,,,,,,,"The superintendent had to allow the attorney to attend the hearing, and has to be reasonable in scheduling the hearing so that the attorney can come.  Was the attorney able to attend the hearing?",
215,Process,Flowchart Shapes,2,19,,,,,,,"During the appeal, the superintendent can look at the record from the hearing with the principal, but they can't rely on that record to make their decision.  The superintendent has to do the hearing from the beginning -- the student must be able to tell their side of the story, present evidence, and present witnesses again.    Did the superintendent conduct a full hearing from the beginning?",
216,Process,Flowchart Shapes,2,19,,,,,,,Did the superintendent base their decision on what happened at the hearing with the principal instead?,
217,Process,Flowchart Shapes,2,19,,,,,,,"Okay, we'll continue to the next section",
218,Process,Flowchart Shapes,2,19,,,,,,,Was the student expelled less than 10 days ago? ,
219,Process,Flowchart Shapes,2,19,,,,,,,"You identified that the student requested an appeal, but the superintendent hasn't held a hearing.  This language will identify that in your complaint: ""The Superintendent failed to hold a hearing following the Student's request for an appeal of an expulsion pursuant to MGL c.71 s37H""  In the box below, explain what happened in detail. Describe everything that happened after the student requested the appeal.  Did the superintendent's office respond to the request at all? Have you or the student followed up on the request? ",
220,Process,Flowchart Shapes,2,19,,,,,,,"You identified that the superintendent didn't conduct the appeal.    This langauge will identify that in your complaint: ""The superintendent delegated an appeal of a 37H expulsion hearing. The appeal may not be delegated.""    In the box below, describe what happened.  Who was the meeting with? Did the superintendent give any reason why they weren't at the meeting? ",
221,Process,Flowchart Shapes,2,19,,,,,,,"You identified that the student's attorney wasn't able to come to the appeal.  This langauge will identify that in your complaint: ""The student was not afforded the right to counsel at the appeal of the 37H hearing.""  In the box below, describe what happened.  How did the superintendent prevent the attorney from coming to the meeting?",
222,Process,Flowchart Shapes,2,19,,,,,,,"You identified that the superintendent relied on the principal's decision instead of having a new hearing from the beginning.  This langauge will identify that in your complaint: ""The superintendent did not review the principal's decision to expel the student under 37H de novo, the standard of review required by 37H.""  In the box below, describe what happened at the hearing. ",
223,Process,Flowchart Shapes,2,19,,,,,,,"You identified that the student didn't get to tell their side of the story and present evidence and witnesses at the appeal.  This language will identify that in your complaint: ""The superintendent failed to conduct an appropriate appeal of an expulsion hearing pursuant to 37H.""  In the box below, describe what happened at the hearing. ",
224,Process,Flowchart Shapes,2,,,,,,,,"This might not be the ride guide for you. Try one of the other guides, or call the EdLaw helpline if you're not sure what guide is best for you.",
225,Process,Flowchart Shapes,2,17,,,,,,,"Okay, we'll move on to the next section.",
226,Process,Flowchart Shapes,2,19,,,,,,,Process,
227,Process,Flowchart Shapes,2,16,,,,,,,"You said that the school is trying to punish the student for bringing drugs to school, but what the student had was alcohol.    This legal language will be included in your complaint:  ""The school is saying that they are disciplining the student for bringing drugs to school. However, the substance that they are accusing the student of bringing to school is alochol, which is not defined as a drug by MGL c.37H.  Therefore the school is improperly discipline the student under 37H for alleged conduct that doesn’t fall within the offenses in 71 MGL s.37H.""  In the box below, explain what happened.  ",
228,Process,Flowchart Shapes,2,16,,,,,,,Is the school accusing the student of bringing alcohol or tobacco to school?,
229,Process,Flowchart Shapes,2,16,,,,,,,"You said that the school is trying to punish the student for bringing drugs to school, but what the student had was tobacco.    This legal language will be included in your complaint:  ""The school is saying that they are disciplining the student for bringing drugs to school. However, the substance that they are accusing the student of bringing to school is tobacco, which is not defined as a drug by MGL c.37H.  Therefore the school is improperly discipline the student under 37H for alleged conduct that doesn’t fall within the offenses in 71 MGL s.37H.""  In the box below, explain what happened.                         ",
230,Process,Flowchart Shapes,2,16,,,,,,,We recommend that you call the EdLaw Project for help.,
231,Process,Flowchart Shapes,2,18,,,,,,,"You identified that the hearing wasn't recorded.  This language will identify that in your complaint: ""The school district did not record the hearing"" WHERE DOES IT SAY THEY HAVE TO  RECORD I",
232,Process,Flowchart Shapes,2,9,,,,,,,Notice  The principal has to tell the student that they're deciding to suspend or expel them in a letter or email.  The letter or email is called 'notice.'   Did the school give the student notice?,
233,Process,Flowchart Shapes,2,9,,,,,,,The student has to get the notice before they're suspended or expelled.  The student has the right to stay in school until they get the notice.  Did the student get the notice before they were suspended or expelled?,
234,Process,Flowchart Shapes,2,9,,,,,,,"The notice has to explain why they're suspending or expelling the student.  First, it has to say what the felony charge is.    Did the notice include a description of the felony charge? ",
235,Process,Flowchart Shapes,2,9,,,,,,,"The notice has to explain why the principal decided to suspend or expel the student becuase of the charge.  The principal can only exclude the student if they decide that the student's presence in school will have a negative effect on the rest of the students.  Did the notice explain why the principal decided to suspend or expel the student, separate from saying what the felony charge was? ",
236,Process,Flowchart Shapes,2,9,,,,,,,"The notice has to tell the student that they have the right to appeal the principal's decision to the superintendent.  Did the notice tell the student about their right to appeal?   Please note: The school has to tell the student about their right to appeal the decision, but it doesn't have to be in the same notice.   They can send a seperate letter or email about the student's right to appeal.",
237,Process,Flowchart Shapes,2,9,,,,,,,"The notice has to tell the student that they that they have to request the appeal within 5 days (calendar days, not school days) of the start of the suspension.    Did the notice tell the student that they had to request the appeal within 5 days?",
238,Process,Flowchart Shapes,2,9,,,,,,,You identified that the school didn't send a letter or email to tell the student that they wouldn't be allowed to come to school.  Do you want to include that in your complaint?,
239,Process,Flowchart Shapes,2,9,,,,,,,"You identified that the school didn't send a letter or email to tell the student that they wouldn't be allowed to come to school.  This language will identify that in your complaint: ""The Principal didn’t provide the notice required by MGL 71 s.37H½ to a student being excluded from school following a felony complaint.""  In the box below, desrcibe what happened in detail.",
240,Process,Flowchart Shapes,2,9,,,,,,,"You identified that the student didn't get the notice before they were suspended or expelled.    This language will identify that in your complaint: ""The student did not receive notice prior to their suspension taking affect pursuant to MGL c.71 s.37H1/2"".  In the box below, describe what happened in detail.",
241,Process,Flowchart Shapes,2,9,,,,,,,"You identified that the notice didn't include a desrciption of the felony charge.    This language will identify that in your complaint: ""The notice of suspension did not include a desrciption of the charge as required by MGL c71 s37H1/2.""  In the box below, add any relevant details.",
242,Process,Flowchart Shapes,2,9,,,,,,,"You identified that the notice didn't explain why the principal decided to suspend or expel the student.   This language will identify that in your complaint: ""The notice of suspension did not include the reasons for the suspension as required by MGL c71 s37H1/2.""  In the box below, add any relevant details.",
243,Process,Flowchart Shapes,2,9,,,,,,,"You identified that the notice didn't tell the student that they have the right to appeal the principal's decision.  This language will identify that in your complaint: ""The student was not notified of their right to appeal the principal's decision to exclude them from school pursuant to MGL c71 s37H1/2.""  In the box below, add any relevant details.  If you did not appeal the decision because you didn't know you could, include that information.",
244,Process,Flowchart Shapes,2,9,,,,,,,"You identified that the notice didn't tell the student that they have the right to appeal the principal's decision.  This language will identify that in your complaint: ""The student was not notified of the process of appealing the principal's decision to exclude them from school pursuant to MGL c71 s37H1/2, including the requirement that they request the appeal within five days.""  In the box below, add any relevant details.  If you did not appeal the decision within the 5 day time limit because you didn't know you had to, include that information.",
245,Process,Flowchart Shapes,2,10,,,,,,,Did the student request an appeal with the superintendent? ,
246,Process,Flowchart Shapes,2,10,,,,,,,"Would you like to include any reasons why the student didn't request the appeal that we didn't already cover in the notice section?   For example, if the student didn't know how, or if the student thought the suspension was automatic because of the felony, you could desribe those concerns.  ",
247,Process,Flowchart Shapes,2,10,,,,,,,"You identified that the student wasn't able to appeal the principal's decision to the superintendent.  This language will identify that concern in your complaint: ""The student was not afforded their right to appeal the principal's decision to exclude them from school to the superintendent pursuant to MGL c71 s37H.""  In the box below, describe in detail what prevented the student from appealing the principal's decision.  ",
248,Process,Flowchart Shapes,2,10,,,,,,,The superintendent has to have the appeal within 3 days of the student's request.    Did the superintendent have the appeal within 3 days?,
249,Process,Flowchart Shapes,2,10,,,,,,,The superintendent has to invite you to the appeal.    Did the superintendent invite you to the appeal?,
250,Process,Flowchart Shapes,2,10,,,,,,,"Now we're going to go through some questions about what has to happen at the appeal.    The student has the right to present testimony at the appeal, meaning they can have someone else support their side of the story at the appeal. The person can come and speak at the appeal, or the person can write a letter for the Superintendent to read at the appeal.  Did the student get to present  testimony at the appeal? ",
251,Process,Flowchart Shapes,2,10,,,,,,,"The student has the right to bring an attorney to the meeting, if their family pays for it. ",
252,Process,Flowchart Shapes,2,10,,,,,,,Did anything else happen at the appeal to prevent the student from getting to explain why the suspension should be overturned?,
253,Process,Flowchart Shapes,2,10,,,,,,,Those are all the requirements for the appeal.,
254,Process,Flowchart Shapes,2,10,,,,,,,"Okay, we'll move onto the next section",
255,Process,Flowchart Shapes,2,11,,,,,,,"Next, we're going to go through the student's right to continue their education while they're out of school. The student has the right to continue doing work and earning credits while they're out of school.   When the school decided to suspend or expel the student, did the school tell you that would the student be able to continue earning credits? ",
