Id,Name,Shape Library,Page ID,Contained By,Group,Line Source,Line Destination,Source Arrow,Destination Arrow,Status,Text Area 1,Text Area 2
331,Process,Flowchart Shapes,2,21,,,,,,,"The hearing has to happen before the suspension starts, except if the principal thinks that keeping the student in school would be dangerous.  Was the student allowed to stay in school until the hearing?  ",
332,Process,Flowchart Shapes,2,21,,,,,,,"The principal can't send the student home, even if it's an emergency removal, without making sure that the student had safe transportation to get home.  Did the principal make sure that the student had a way to get home before the student left the school building?",
333,Process,Flowchart Shapes,2,21,,,,,,,"You identified that the student wasn't allowed to stay in school until the suspension hearing.  This language will identify that in your complaint: ""The principal excluded the student from school prior to holding a hearing, and where there was No emergency removal.  The student had the right to stay in school until there was a hearing.  603 CMR 53.06 requires that the principal hold a hearing prior to imposing a suspension under 37H3/4 where there is No emergency removal.""  In the box below, add details.  Include how long the student was out of school before they had a hearing.",
334,Process,Flowchart Shapes,2,21,,,,,,,"You identified that the principal didn't call you to tell you they had done an emergency removal and sent the student home.    This language will identify that in your complaint: ""The student was excluded from school on an emergency basis pursuant to 603 CMR 53.07, and the principal failed to notify the parent""  In the box below, add details.  If you didn't know that the student had been sent home, include that information, as well as anything that happened because you didn't know.",
335,Process,Flowchart Shapes,2,21,,,,,,,"You identified that the principal didn't make sure the student had safe transportation before sending them home from school.  This language will identify that in your complaint: ""The principal did not provide for the student's safety and transportation before removing them from school pursuant to 603 CMR 53.07""  In the box below, describe what happened in detail.  What did the student do when they had to leave school?",
336,Process,Flowchart Shapes,2,21,,,,,,,"You identified that the student was out of school for more than two days after an emergency removal without getting a hearing.   This language will identify that in your complaint: ""The student was removed on an emergency basis pursuant to 603 CMR 53.07, and was therefore entitled to a hearing or to return to school after the two-day temporary removal period.  The school kept the student out of school for longer than two days without a hearing.""  In the box below, add details.  Include how long the student was out of school before getting a hearing.",
337,Process,Flowchart Shapes,2,21,,,,,,,"You identified that the principal did an emergency removal because they thought the student was dangerous, but you disagree with their decision.  This language will identify that in your complaint: ""603 CMR 53.07(1) provides that the principal may temporarily exclude a student when 'the continued presence of the student poses a danger to persons or property, or materially and substantially disrupts the order of the school, and, in the principal's judgment, there is No alternative available to alleviate the danger or disruption.'  Here, the principal excluded the student before holding a hearing, and the requisite conditions were not met.""  In the box below, add details.  Explain why you don't feel the student had to leave school.  Include any reasons why it wasn't dangerous for the student to be in school, or any alternatives the principal could have used instead of sending the student home.",
338,Process,Flowchart Shapes,2,21,,,,,,,Those are all the questions about the hearing happening after the student was excluded from school.  Now we're going to go through questions about what has to happen at the hearing.,
339,Process,Flowchart Shapes,2,21,,,,,,,"You identified that at the hearing, the Principal didn't talk about why the student was being suspended in detail.  This language will identify that in your complaint: ""The principal failed to hold an appropriate hearing before issuing a suspension, as required by CMR 53.08(2), because the principal failed to adequately discuss the disciplinary offense.""  In the box below, explain what happened at the hearing.  If you weren't sure why the student was being disciplined, include that information.  If you had questions but the principal didn't listen, include that.",
340,Process,Flowchart Shapes,2,21,,,,,,,"You identified that the Principal didn't give the student a chance to tell their side of the story.  This language will identify that in your complaint: ""The principal failed to hold an appropriate hearing before issuing a suspension, as required by CMR 53.08(2), because the student did not have an adequate opportunity to present information.""  In the box below, explain what happened at the hearing.  Include anything that happened to prevent the student from telling their side of the story.",
341,Process,Flowchart Shapes,2,21,,,,,,,Did the principal let the advocate attend the hearing?,
342,Process,Flowchart Shapes,2,21,,,,,,,"You identified that the Principal didn't give the student a chance to review their record and other documents the Principal was going to rely on at the hearing.  This language will identify that in your complaint: ""The principal did not afford the student the rights required by CMR 53.08(3) when deciding whether to issue a long term suspension, because they failed to allow the student to review their record and the documents upon which the principal may rely in making a determination to suspend the student.""  Explain what happened.  If the student didn't get to review the documents because you didn't know they could, include that information.  ",
343,Process,Flowchart Shapes,2,21,,,,,,,"You identified that the Principal didn't let the student bring a lawyer or advocate to the hearing.    This language will identify that in your complaint: ""The principal did not afford the student the rights required by CMR 53.08(3) when deciding whether to issue a long term suspension, because the student wasn’t afforded the right to be represented by counsel or a lay person of the student’s choice.""  Explain what happened.  If the student didn't get to bring an advocate to the hearing because you didn't know they could, include that information. If the student wanted to bring someone to the hearing and the school wouldn't schedule the meeting to accommodate their schedule, include that information.",
344,Process,Flowchart Shapes,2,21,,,,,,,"You identified that the Principal didn't let the student bring witnesses to the hearing to support the student's side of the story.   This language will identify that in your complaint: ""The principal did not afford the student the rights required by CMR 53.08(3) when deciding whether to issue a long term suspension, because the student wasn’t afforded the right to produce witnesses.""  Explain what happened.  If the student didn't get to bring witnesses to the hearing because you didn't know they could, include that information. ",
345,Process,Flowchart Shapes,2,21,,,,,,,"You identified that the Principal didn't let the student ask the school's witnesses questions.   This language will identify that in your complaint: ""The principal did not afford the student the rights required by CMR 53.08(3) when deciding whether to issue a long term suspension, because the student wasn’t afforded the right to cross-examine witnesses presented by the District.""  Explain what happened during the hearing. If the student didn't ask questions because they didn't know they could, include that information.  ",
346,Process,Flowchart Shapes,2,21,,,,,,,"You identified that the student wasn't able to have the hearing recorded.  This language will identify that in your complaint: ""The principal did not afford the student the rights required by CMR 53.08(3) when deciding whether to issue a long term suspension, because the student wasn’t afforded the right to request that the hearing be recorded by the principal, and to receive a copy of the recording upon request.""  In the box below, explain what happened when the student asked for the recording.",
347,Process,Flowchart Shapes,2,21,,,,,,,"Did the principal record the hearing, and provide the student with a copy of the recording?",
348,Process,Flowchart Shapes,2,22,,,,,,,"Once the school decides to suspend the student, they have to send a second notice, called a 'Decision Notice.'  This is different than the first suspension notice, which the school sends and before they decide whether or not to suspend the student.  The school has to send the Decision Notice after the hearing. If they failed to have a hearing, they still have to send the notice.  Did the school send you a letter or email with information about their decision to suspend the student? ",
349,Process,Flowchart Shapes,2,22,,,,,,,"You identified that you didn't get notice of the principal's decision after the hearing.   This language will identify that violation in your complaint: 	
""The principal did not provide written notice to the student and the parent/guardian of their determination following the suspension hearing, as required by CMR 53.08(2).""  Add details in the box below, including what happened after the hearing.  If you weren't sure what the principal decided at the hearing, include that information.  ",
350,Process,Flowchart Shapes,2,22,,,,,,,Did the notice tell you why the principal decided to suspend the student?,
351,Process,Flowchart Shapes,2,22,,,,,,,Those are all the notice of decision requirements. We'll move onto the next section.,
352,Process,Flowchart Shapes,2,22,,,,,,,"You identified that the hearing decision didn't tell you why the principal decided to suspend the student.    This language will identify that in your complaint: ""The principal failed to notify the parent of the reasons for their decision to suspend the student following the hearing, as required by CMR 53.08(2).""  In the box below, add details.  If you were/are unsure of why the principal decided to suspend the student, include that information.",
353,Process,Flowchart Shapes,2,24,,,,,,,The school has to try to work with the student to figure out how to address the behavior that the school is concerned about before they move to exclude the student from school.    Did the school try anything else before moving to suspend the student? ,
354,Process,Flowchart Shapes,2,24,,,,,,,"You identified that the school didn't try any alternatives before moving to suspend the student.  This language will identify that in your complaint: ""The school failed to attempt alternatives prior to exclusion as required by 603 CMR 53.05.""  Add details in the box below.    Please note that students with disabilities have additional rights when the school excludes them from school.    SHOW THIS IF IT'S A LONG TERM SUSPENSION: If the alternatives the school could have tried relate to the services in the student's IEP (for example, the school changed the student's routine and it caused the behavior) you can mention the issue here, but we will cover the concern in more detail in a later section.",
355,Process,Flowchart Shapes,2,22,,,,,,,"Did the notice tell you how many days the suspension would be, and whether the suspension would be in-school or out-of-school?",
356,Process,Flowchart Shapes,2,22,,,,,,,DId the notice tell you that the student could make up work while they're out of the classroom?,
357,Process,Flowchart Shapes,2,22,,,,,,,"You identified that the hearing decision didn't tell you how long the student was suspended, and whether the suspension was in-school or out-of-school.  This language will identify that in your complaint: ""The principal failed to notify the parent of the type and duration of the suspension following a hearing pursuant to CMR 53.08(2).""  In the box below, add details. ",
358,Process,Flowchart Shapes,2,22,,,,,,,"You identified that the hearing decision didn't tell you that the student would be able to make up work while they were out of school.  This language will identify that in your complaint: ""The principal failed to notify the parent of the student's opportunity to make up school work during the suspension in the decision notice following the suspension hearing, pursuant to CMR 53.08(2).""  In the box below, add details.   Please note that we'll go over some questions about the student's right to make up work in a later section.  If they missed work because they didn't know they could make it up, include that information here, but you don't need to go into too much detail about the work they missed yet.",
359,Process,Flowchart Shapes,2,15,,,,,,,"Students with disabilities have additional school discipline rights.  Students with disabilities have the right to a meeting with their IEP team when they're excluded from school for more than 10 days.  The meeting is called a Manifestation Determination Review, or MDR.    The point of the MDR is to figure out whether the student's behavior was caused by the school's failure to give the student the special education services they need.  We're going to go through some questions about the MDR.",
360,Process,Flowchart Shapes,2,15,,,,,,,Did the school have a meeting with the student's IEP team to talk about the discipline?,
361,Process,Flowchart Shapes,2,15,,,,,,,The meeting has to be within 10 school days of the decision to suspend or expel the student.    Did the school have the meeting within 10 days? ,
362,Process,Flowchart Shapes,2,15,,,,,,,"At the meeting, the student's IEP team has to decide whether the student's behavior was related to their disability, and/or caused by the school not providing the student's special education services. To make the decision, the IEP team should review the student's file and consider any information that you provide.  Did the school decide whether the behavior they're accusing the student of was related to the student's disability or the school's failure to give the student their special education serivices?",
363,Process,Flowchart Shapes,2,15,,,,,,,"If the IEP team decides that the behavior was related to the student's disability, or caused by the school not giving the student their services, the school can't proceed with the discipline.    Did the IEP team decide that the behavior was related to the student's disability or caused by the school not giving the student their services?",
364,Process,Flowchart Shapes,2,15,,,,,,,"You identified that the IEP team didn't think that the behavior was related to the student's disability, but you disagree.  This language will identify that concern in your complaint: ""The School District found that the behavior was not a manifestation of the student's disability, but I disagree.""  In the box below, explain why you disagree in detail.  Describe why the behavior was related to the student's disability, and/or why the behavior was caused by the school's failure to give the student their special education services.  If the student doesn't have an IEP or 504 plan, you should also explain how the school knew that the student has a disability.  For example, you might say 'I sent an email to the school to ask for a special education evaluation at the end of last month.'",
365,Process,Flowchart Shapes,2,15,,,,,,,"When the IEP team decides that the behavior was caused by the student's disability or the school's failure to provide the student's services, they can't exclude the student.    Did the school stop excluding the student after the meeting?",
366,Process,Flowchart Shapes,2,15,,,,,,,"When the IEP team decides that the behavior was caused by the student's disability, it means that the school wasn't providing the student with the special education services they need.  The school has to take immediate steps to figure out what services the student needs.    The first step the school has to take is to do an evaluation of the student's needs called a Functional Behavioral Assessment, or FBA.  If the student already has one, the school has to review and update the assessment.  Did the school do an FBA?",
367,Process,Flowchart Shapes,2,15,,,,,,,You identified that the school didn't do a Functional Behavioral Assessment.  We'll ask more questions about that at the end of this section.,
368,Process,Flowchart Shapes,2,15,,,,,,,"The next step the school has to take is to make a Behavioral Intervention Plan, or BIP, for the student.  If the student already has one, the school has to review and update it.    Did the school create a BIP?",
369,Process,Flowchart Shapes,2,15,,,,,,,Those are all the requirements for the MDR.,
370,Process,Flowchart Shapes,2,15,,,,,,,Did the student already have an FBA?,
371,Process,Flowchart Shapes,2,15,,,,,,,Did the school review and update the old FBA?,
372,Process,Flowchart Shapes,2,15,,,,,,,You identified that the school didn't review and update the student's Functional Behavioral Assessment. We'll ask more questions about that at the end of this section.,
373,Process,Flowchart Shapes,2,15,,,,,,,You identified that the school didn't create a Behavioral Intervention Plan. We'll ask more questions about that at the end of this section.,
374,Process,Flowchart Shapes,2,15,,,,,,,Did the student already have an BIP?,
375,Process,Flowchart Shapes,2,15,,,,,,,Did the school review and update the old BIP?,
376,Process,Flowchart Shapes,2,15,,,,,,,You identified that the school didn't review and update the student's Behavioral Intervention Plan.  We'll ask more questions about that at the end of this section.,
377,Process,Flowchart Shapes,2,15,,,,,,,"This language will identify that in your complaint: ""The School District failed to hold a manifestation determination review meeting after changing the student's placement due to a disciplinary removal.  34 CFR §300.536(e) requires that the District convene an IEP meeting within 10 school days of the decision to change the student's placement.""  In the box below, describe what happened.  If you didn't know that the school had to have the meeting, include that information.  If you asked the school to have the meeting and they refused, include that.  You should also describe what has happened since the student has been out of school, and whether the student has been able to get any of their services.  If the student doesn't have an IEP or 504 plan, you should also explain how the school knew that the student has a disability.  For example, you might say 'I sent an email to the school to ask for a special education evaluation at the end of last month.'",
378,Process,Flowchart Shapes,2,15,,,,,,,"You identified that there was a meeting with the student's IEP team, but the team didn't decide whether the behavior was related to the student's disability.    This language will identify that in your complaint: ""At the manifestation determination review following a change of placement due to a disciplinary removal, the school failed to determine whether the conduct in question was caused by the student's disability, or whether the conduct in question was the direct result of the LEA's failure to implement the student's IEP.  34 CFR §300.530(e) requires that the school determine the answers to those questions to determine whether the conduct was a manifestation of the student's disability.""  In the box below, describe what happened at the meeting.  Include who was at the meeting, whether you were able to participate in the meeting, and what happened to prevent the IEP team from answering the questions.  ",
379,Process,Flowchart Shapes,2,15,,,,,,,"You identified that the IEP team determined that the behavior was related to the student's disability, but didn't let the student come back to school.   This language will identify that in your complaint: ""Following a determination that the student's behavior was a manifestation of their disability pursuant to 34 CFR 300.530(e), the school proceeded with the disciplinary removal rather than taking immediate steps to remedy the deficiencies, as required by 34 CFR 300.530(e)(3).""  In the box below, explain what happened.  If the school never told you that the student had the right to come back to school, include that.  If you wanted the student to return to school but the school said they couldn't, include that information.  ",
380,Process,Flowchart Shapes,2,,,,,,,,What is a suspension or expulsion?,
381,Process,Flowchart Shapes,2,,,,,,,,"There are two kinds of suspensions, an in-school-suspensions and an out-of-school suspension. An in-school-suspension is when a student is told they have to leave their classroom and work in a different classroom for more than half of a school day. An out-of-school suspension is when the student is told they cannot come back to school at all for a certain number of days. An expulsion is when the student is told they cannot come back to school for more than 90 school days.",
382,Process,Flowchart Shapes,2,9,,,,,,,"You haven't identified a problem with a requirement included in this guide.  If you have concerns about the school's communication about the hearing, you should still include them in the complaint.    Would you like to describe any concerns to include in your complaint?",
383,Process,Flowchart Shapes,2,9,,,,,,,"Okay, we'll move onto the next section.",
384,Process,Flowchart Shapes,2,9,,,,,,,"Okay, please describe your concerns below.",
385,Process,Flowchart Shapes,2,9,,,,,,,"The notice has to explain why they're suspending or expelling the student.  First, it has to say what the felony charge is.    Did the notice include a description of the felony charge? ",
386,Process,Flowchart Shapes,2,9,,,,,,,"The notice has to explain why the principal decided to suspend or expel the student becuase of the charge.  The principal can only exclude the student if they decide that the student's presence in school will have a negative effect on the rest of the students.  Did the notice explain why the principal decided to suspend or expel the student, separate from saying what the felony charge was? ",
387,Process,Flowchart Shapes,2,9,,,,,,,"The notice has to tell the student that they have the right to appeal the principal's decision to the superintendent.  Did the notice tell the student about their right to appeal?   Please note: The school has to tell the student about their right to appeal the decision, but it doesn't have to be in the same notice.   They can send a seperate letter or email about the student's right to appeal.",
388,Process,Flowchart Shapes,2,9,,,,,,,"The notice has to tell the student that they that they have to request the appeal within 5 days (calendar days, not school days) of the start of the suspension.    Did the notice tell the student that they had to request the appeal within 5 days?",
389,Process,Flowchart Shapes,2,11,,,,,,,What are alternative education options?,
390,Process,Flowchart Shapes,2,11,,,,,,,"Alternative education services are options like tutoring, placement at a different school, Saturday school, or online learning, that a school offers to help a student continue their education while they're out of school. ",
391,Process,Flowchart Shapes,2,11,,,,,,,What should I include?,
392,Process,Flowchart Shapes,2,11,,,,,,,Did the student ever find out that they would be able to earn credits? Did the student miss any opportunities to earn credits becuase they didn't know about them?,
393,Process,Flowchart Shapes,2,11,,,,,,,Did you ever find out about education services? What happened because the school didn't tell you about them? ,
394,Process,Flowchart Shapes,2,11,,,,,,,What does this mean?,
395,Process,Flowchart Shapes,2,11,,,,,,,"The school district has to make sure the student is able to actually start doing the education service they choose.  For example, if the school offered tutoring as an education service, and the student chooses tutoring, the District has to make sure that the student knows how to sign up for tutoring.",
396,Process,Flowchart Shapes,2,,,,,,,,What does this mean?,
397,Process,Flowchart Shapes,2,,,,,,,,The student has a disability that the school knows about if any of these apply to the student:  - they get special education services through an IEP or 504 plan  - someone has requested that the school do a special education evaluation for the student,
398,Process,Flowchart Shapes,2,15,,,,,,,What is an IEP Team?,
399,Process,Flowchart Shapes,2,15,,,,,,,"The student's IEP team is the group of people who meet to make the student's special education plan every year.  If the student didn't have a special education plan when the discipline happened, but the school knew the student has a disability, then the IEP team would be ... ",
400,Process,Flowchart Shapes,2,15,,,,,,,How does the team decide?,
401,Process,Flowchart Shapes,2,15,,,,,,,"At the meeting, the IEP team has to go through these two questions:  1. Is the conduct a direct result of the district's failure to implement the student's IEP, and  2. Does the behavior have a direct and substantial relationship to the student's disability? If the answer to either question is yes, then the behavior is related to the student's disability.",
402,Process,Flowchart Shapes,2,21,,,,,,,What counts as dangerous?,
